<?xml version="1.0" encoding="UTF-8"?>
<!DOCTYPE geode SYSTEM "geode.dtd" >
<geode>
    <servers>
        <server id="MyServer" ip="127.0.0.1" port="50000" backlog="50">
            <protocols>
                <protocol class="MainSRV"/>
            </protocols>
        </server>
    </servers>
    <clients>
        <client id="MyClient" server-ip="127.0.0.1" server-port="50000" protocol="MainCLI"/>
        <client id="Producer" server-ip="127.0.0.1" server-port="50000" protocol="Producer"/>
    </clients>
</geode>
